[
    {
        "id": "RF-2023-Q4",
        "title": "Q4 2023 AML Compliance Report",
        "filingDate": "2024-01-15",
        "regulator": "FCA",
        "status": "Submitted",
        "summary": "Quarterly report detailing Anti-Money Laundering monitoring activities. This report summarizes the alerts generated by the transaction monitoring system, the number of Suspicious Activity Reports (SARs) filed, and the outcome of enhanced due diligence (EDD) reviews.\n\nIt also highlights key risks identified during the quarter, such as increased activity in high-risk jurisdictions or emergence of new typologies. The report includes metrics on the timeliness of alert disposition and the quality of investigations conducted by the AML team.",
        "category": "RegulatoryFiling",
        "sensitivity": "Confidential"
    },
    {
        "id": "RF-2024-01",
        "title": "Suspicious Activity Report (SAR) - TRD-998",
        "filingDate": "2024-02-10",
        "regulator": "FinCEN",
        "status": "Review",
        "summary": "Investigation into unusual trading patterns by desk alpha. This Suspicious Activity Report (SAR) documents a series of trades executed on February 10, 2024, involving a large position in XYZ Corp just before a positive earnings announcement.\n\nThe trader in question, 'Trader A', had no prior history of trading this specific equity. The timing and size of the trade suggest potential knowledge of MNPI. The account has been placed under heightened supervision, and this report is filed with FinCEN in accordance with the Bank Secrecy Act.",
        "category": "RegulatoryFiling",
        "sensitivity": "Restricted"
    },
    {
        "id": "HR-2024-DISC",
        "title": "Disciplinary Action Report - Trader X",
        "filingDate": "2024-02-12",
        "regulator": "Internal",
        "status": "Closed",
        "summary": "HR disciplinary record regarding unauthorized communications. Employee 'Trader X' was found to be using WhatsApp to communicate with three hedge fund clients regarding market color and pricing. This is a direct violation of the Communications Policy (TR-003).\n\nThe employee has been issued a formal written warning and their bonus for the current year is subject to clawback provisions. Mandatory training on communication compliance has been assigned and must be completed within 30 days. Further violations will result in termination.",
        "category": "HRRecord",
        "sensitivity": "Confidential"
    },
    {
        "id": "RF-COREP-2024-Q1",
        "title": "FCA COREP (Common Reporting) - Capital Adequacy",
        "filingDate": "2024-04-30",
        "regulator": "FCA / PRA",
        "status": "Submitted",
        "summary": "Standardized reporting detailing Tier 1 capital ratios, risk-weighted assets, and leverage ratios under the Capital Requirements Regulation (CRR). This dataset is critical for the regulator to assess the bank's solvency and resilience to stress.\n\nThe report covers credit risk, market risk, and operational risk components. Significant changes from the previous quarter include an increase in RWA due to a new model validation adjustment for the equity trading desk. The current CET1 ratio stands at 14.5%, well above the regulatory minimum.",
        "category": "RegulatoryFiling",
        "sensitivity": "Confidential"
    },
    {
        "id": "RF-10K-2023",
        "title": "SEC Form 10-K Annual Report (2023)",
        "filingDate": "2024-03-01",
        "regulator": "SEC",
        "status": "Published",
        "summary": "Comprehensive annual financial performance report, including Regulation S-K Item 1400 disclosures on Net Interest Margin and Loan Portfolio Composition. This document provides a detailed overview of CEBank International's financial health, business strategy, and risk factors.\n\nKey sections include Management's Discussion and Analysis (MD&A), audited financial statements, and notes to the accounts. It also discloses legal proceedings, executive compensation, and market risk disclosures. This public filing is available to all investors and stakeholders.",
        "category": "RegulatoryFiling",
        "sensitivity": "Public"
    },
    {
        "id": "RF-FFIEC-031-2024",
        "title": "FFIEC Call Report - Consolidated",
        "filingDate": "2024-04-15",
        "regulator": "FDIC",
        "status": "Submitted",
        "summary": "Quarterly report assessing the bank's health based on the CAMELS rating system (Capital, Assets, Management, Earnings, Liquidity, Sensitivity). This consolidated report aggregates data from all domestic and foreign offices of CEBank.\n\nIt provides granular data on loan performance, allowance for credit losses (ACL), and deposit insurance assessments. The data is used by the FDIC to calculate deposit insurance premiums and monitor systemic risk.",
        "category": "RegulatoryFiling",
        "sensitivity": "Confidential"
    },
    {
        "id": "RF-SAR-994",
        "title": "Suspicious Activity Report (SAR) - Client Alpha",
        "filingDate": "2024-02-28",
        "regulator": "FinCEN",
        "status": "Submitted",
        "summary": "Confidential report detailing structured cash deposits indicative of potential money laundering by retail client. The client, 'Client Alpha', made 14 cash deposits of $9,500 over a two-week period at different branch locations.\n\nThis pattern, known as 'structuring' or 'smurfing', is designed to evade the $10,000 Currency Transaction Report (CTR) filing threshold. The source of funds could not be verified, and the client's stated occupation does not support this volume of cash. We recommend account closure.",
        "category": "RegulatoryFiling",
        "sensitivity": "Restricted"
    }
]